{
  "attributes": {
    "workload_kind": "container_service"
  },
  "category": "runtime_workload",
  "container_id": "01a0c450-ba24-7377-aa19-fe4be6b9502c",
  "display_name": "rating-api-svc",
  "entity_id": "01a0c450-ba25-734a-a22e-ddc26f3b6544",
  "environment_id": "01a0c450-6c0f-7b86-8a9f-6696486b056d",
  "environment_scope": "single",
  "expires_at": null,
  "lifecycle": "active",
  "merged_into": null,
  "native_type": "AWS::ECS::Service",
  "org_id": "01a0c450-6c01-76c4-8c39-8171fd4953d6",
  "provider": "aws",
  "record_state": "present",
  "revision_from": 2,
  "revision_to": null,
  "taxonomy_version": "1.0.0",
  "trust_state": "discovered",
  "type_key": "infra.workload",
  "verification_state": "unverified",
  "verified_at": null,
  "verified_by": null
}
