{
  "attributes": {},
  "category": "data_store",
  "container_id": "01a0c450-70ef-7a2f-8462-71f80239b16f",
  "display_name": "sqldb-claims",
  "entity_id": "01a0c450-70fe-7574-b64d-d40027c9f799",
  "environment_id": "01a0c450-6c0f-7b86-8a9f-6696486b056d",
  "environment_scope": "single",
  "expires_at": null,
  "lifecycle": "active",
  "merged_into": null,
  "native_type": "microsoft.sql/servers/databases",
  "org_id": "01a0c450-6c01-76c4-8c39-8171fd4953d6",
  "provider": "azure",
  "record_state": "present",
  "revision_from": 1,
  "revision_to": null,
  "taxonomy_version": "1.0.0",
  "trust_state": "discovered",
  "type_key": "azure.sql_database",
  "verification_state": "unverified",
  "verified_at": null,
  "verified_by": null
}
